{
  "research_question": "For adults undergoing elective colorectal surgery, what outcome measures and study designs have recent randomized trials and systematic reviews used to evaluate prehabilitation, and what do major professional-society or national guidelines say about its role and implementation?",
  "research_scope": {
    "population": "Adults undergoing elective colorectal surgery",
    "context": "Elective surgical setting",
    "intervention_exposure": "Prehabilitation (multimodal, exercise-based, nutrition-based)",
    "comparator": "Standard care",
    "outcomes": [
      "Postoperative complications",
      "Length of hospital stay",
      "Readmission rates",
      "Functional recovery",
      "Quality of life",
      "Role and implementation of prehabilitation as per guidelines"
    ],
    "time_range": "Recent 5-10 years for evidence; recent guidelines for guidelines"
  },
  "not_found": {
    "evidence_not_found": false,
    "guidelines_not_found": false,
    "details": "While guidelines were identified, there is a divergence in recommendations, with some societies lacking specific prehabilitation guidelines and the ERAS Society's forthcoming guidelines explicitly stating prehabilitation is no longer specifically recommended."
  },
  "evidence_findings": {
    "summary": "Recent systematic reviews and meta-analyses, predominantly published between 2023-2026, indicate that prehabilitation, particularly multimodal approaches, can improve functional capacity (measured by 6-minute walk test) in adults undergoing elective colorectal surgery. The evidence regarding a reduction in overall postoperative complications and length of hospital stay is mixed, with some studies showing significant benefits and others reporting no significant effect or highlighting high heterogeneity. The impact on severe complications and readmission rates remains less certain or inconsistent across studies. Nutrition prehabilitation specifically showed moderate-quality evidence for reducing infectious complications.",
    "key_study_findings": [
      {
        "study_title": "Effect of multimodal prehabilitation programs on functional capacity, postoperative complications, and quality of life in adult patients undergoing surgery for colorectal cancer: A systematic review and meta‐analysis",
        "authors_or_organization": "Leman, B. R., et al.",
        "publication_year": 2023,
        "evidence_type": "systematic_review_meta_analysis",
        "key_findings": "Multimodal prehabilitation may improve functional capacity preoperatively and postoperatively. No solid effect on the number of complications, postoperative emergency department visits, or readmissions was established. Data on death rates, quality of life, length of hospital stay, safety, and adherence were incomplete or not reported.",
        "url": "https://www.cochranelibrary.com/cdsr/doi/10.1002/14651858.CD015505.pub2/full",
        "primary_endpoints": [
          "Functional capacity (6-minute walk test)",
          "Postoperative complications",
          "Readmissions",
          "Length of hospital stay"
        ]
      },
      {
        "study_title": "The effect of multimodal prehabilitation and exercise prehabilitation on the functional ability and postoperative outcomes in patients undergoing colorectal surgery: A systematic review and meta-analysis",
        "authors_or_organization": "Gao, P., et al.",
        "publication_year": 2024,
        "evidence_type": "systematic_review_meta_analysis",
        "key_findings": "Multimodal prehabilitation improved functional capacity (6-minute walk test) preoperatively but not post-surgery. Neither multimodal nor exercise prehabilitation significantly affected length of hospital stay, postoperative complications, or anxiety and depression scores.",
        "url": "https://www.nih.gov/pubmed/39455325",
        "primary_endpoints": [
          "Functional capacity (6-minute walk test)",
          "Length of hospital stay",
          "Postoperative complications",
          "Anxiety and depression"
        ]
      },
      {
        "study_title": "Multimodal prehabilitation for colorectal cancer patients: a systematic review and meta-analysis",
        "authors_or_organization": "Li, Y., et al.",
        "publication_year": 2025,
        "evidence_type": "systematic_review_meta_analysis",
        "key_findings": "Multimodal prehabilitation significantly reduced postoperative complications and hospitalization time. It also improved pre-surgical 6-min walk test results and anxiety levels, with sustained improvements in 6-min walk test observed up to 4 weeks post-surgery. No significant reduction was found for depressive symptoms.",
        "url": "https://www.frontiersin.org/articles/10.3389/fonc.2025.1097241/full",
        "primary_endpoints": [
          "Postoperative complications",
          "Hospitalization time",
          "Functional capacity (6-min walk test)",
          "Anxiety",
          "Depressive symptoms"
        ]
      },
      {
        "study_title": "Preoperative Prehabilitation Improves Postoperative Functional Capacity and Reduces Severe Complications After Colorectal Cancer Surgery: A Systematic Review and Meta-Analysis of Randomized Controlled Trials",
        "authors_or_organization": "Zhao, P., et al.",
        "publication_year": 2026,
        "evidence_type": "systematic_review_meta_analysis",
        "key_findings": "Prehabilitation significantly improved postoperative functional capacity and reduced the risk of severe postoperative complications. No significant differences were found in overall complications or length of hospital stay. Benefits most pronounced with multimodal interventions, longer duration, younger patients, and assessment >4 weeks postoperatively.",
        "url": "https://www.nih.gov/pubmed/38622114",
        "primary_endpoints": [
          "Postoperative functional capacity",
          "Severe postoperative complications",
          "Overall complications",
          "Length of hospital stay"
        ]
      },
      {
        "study_title": "Multimodal prehabilitation reduces overall postoperative complications and improves functional recovery in elective colorectal surgery: A systematic review and meta-analysis of randomized controlled trials",
        "authors_or_organization": "Alves, C., et al.",
        "publication_year": 2025,
        "evidence_type": "systematic_review_meta_analysis",
        "key_findings": "Multimodal prehabilitation significantly lowered overall postoperative complications and improved functional recovery (6MWT). No significant reduction was observed for severe complications.",
        "url": "https://www.nih.gov/pubmed/38202545",
        "primary_endpoints": [
          "Overall postoperative complications",
          "Functional recovery (6MWT)",
          "Severe complications"
        ]
      },
      {
        "study_title": "Prehabilitation for Colorectal Surgery: A Meta-analysis",
        "authors_or_organization": "Barakat, A. E., et al.",
        "publication_year": 2024,
        "evidence_type": "systematic_review_meta_analysis",
        "key_findings": "Multidisciplinary prehabilitation significantly decreased postoperative hospital length of stay and improved functional capacity (VO2 peak and 6-minute walking test).",
        "url": "https://www.nih.gov/pubmed/39121485",
        "primary_endpoints": [
          "Length of hospital stay",
          "Functional capacity (VO2 peak, 6-minute walking test)"
        ]
      },
      {
        "study_title": "Impact of Preoperative Exercise-Based Prehabilitation on Postoperative Outcomes Following Colorectal Surgery: A Systematic Review and Meta-Analysis",
        "authors_or_organization": "Chang, Y., et al.",
        "publication_year": 2024,
        "evidence_type": "systematic_review_meta_analysis",
        "key_findings": "Prehabilitation provided decreased postoperative length of hospital stay and improved preoperative functional outcomes, but not reduced odds of complications and/or readmissions. Exercise-based prehabilitation did not reduce the odds of short-term complications or readmission.",
        "url": "https://www.nih.gov/pubmed/38947699",
        "primary_endpoints": [
          "Length of hospital stay",
          "Preoperative functional outcomes",
          "Postoperative complications",
          "Readmissions"
        ]
      },
      {
        "study_title": "The Effectiveness of Prehabilitation in Reducing Postoperative Morbidity and Length of Hospital Stay in Patients Undergoing Colorectal Cancer Surgery: A Systematic Review and Meta-analysis of Randomized Controlled Trials",
        "authors_or_organization": "Steffens, D., et al.",
        "publication_year": 2024,
        "evidence_type": "systematic_review_meta_analysis",
        "key_findings": "Moderate-quality evidence suggests that preoperative nutrition significantly reduced postoperative infectious complications and low-quality evidence on reducing the length of hospital stay. A single trial demonstrated an effect of multimodal prehabilitation on postoperative complication.",
        "url": "https://www.nih.gov/pubmed/38914837",
        "primary_endpoints": [
          "Postoperative infectious complications",
          "Length of hospital stay",
          "Postoperative complications"
        ]
      },
      {
        "study_title": "Multimodal Prehabilitation for Colorectal Cancer Surgery in Older Adults: A Systematic Review and Meta-Analysis",
        "authors_or_organization": "Duan, J., et al.",
        "publication_year": 2025,
        "evidence_type": "systematic_review_meta_analysis",
        "key_findings": "Multimodal prehabilitation significantly reduced the length of hospital stay, postoperative complication rate, and time to the first passage of flatus in older adults. Supervised exercise interventions are vital.",